{"$schema":"https://json-schema.org/draft/2020-12/schema","additionalProperties":false,"properties":{"alias_map":{"additionalProperties":{"pattern":"^[0-9a-f]{24}$","type":"string"},"type":"object"},"input_sha256":{"pattern":"^[0-9a-f]{64}$","type":"string"},"physical_groups":{"items":{"additionalProperties":false,"properties":{"physical_id":{"pattern":"^[0-9a-f]{24}$","type":"string"},"roots":{"items":{"pattern":"^[0-9a-f]{24}$","type":"string"},"minItems":1,"type":"array","uniqueItems":true}},"required":["physical_id","roots"],"type":"object"},"type":"array"},"schema_version":{"const":"pcg-physical-sidecar.v1"}},"required":["schema_version","input_sha256","physical_groups","alias_map"],"type":"object"}
