{"alias_map":{"A":"b02124c10ae59daf87bf1d21","B1":"9d0ecfc8687e5b1897f3c7d1","B2":"99735e92b897a35c301b57c4","B3":"a143e0b947f205f4a768cfd5","B4":"b87290480229f234ef96c2dd","B5":"c14ad3c881c7d49b5992a5cd","B6":"8fe7b73f464b01597857eb5f","B7":"bb380af7c13c0dea6164e237","D1":"d81cd5df3552fc64b87d299c","D2":"6cc7244fe58b5263237b445f","D3":"c8fdd2d0c7cd49c15b3290f0","I":"ed001fd07df08ab533ec7257","R":"75718a836667e8f3f86ea7c5"},"input_sha256":"54458906c9522138661db8a03ba227b09ec78cb5bb4c1ab24e7c94fa647d7028","physical_groups":[{"physical_id":"4d70dabe37eea12b74939561","roots":["b02124c10ae59daf87bf1d21"]},{"physical_id":"1a0136094ecff2b39bf278a2","roots":["ed001fd07df08ab533ec7257"]},{"physical_id":"8313e750371dfec49835f278","roots":["9d0ecfc8687e5b1897f3c7d1"]},{"physical_id":"f3bc7632879dc954bcc72201","roots":["99735e92b897a35c301b57c4"]},{"physical_id":"ae4863d4e3815fc52869f541","roots":["a143e0b947f205f4a768cfd5"]},{"physical_id":"c71de54d2859dd81217d5cbe","roots":["b87290480229f234ef96c2dd"]},{"physical_id":"7525ab69c4d2e95bf4bfefee","roots":["c14ad3c881c7d49b5992a5cd"]},{"physical_id":"f8d5c95306847a701b51837e","roots":["8fe7b73f464b01597857eb5f"]},{"physical_id":"19be982675635577585fb26f","roots":["bb380af7c13c0dea6164e237"]}],"schema_version":"pcg-physical-sidecar.v1"}
